{"artifact_set_digest":"254f7c235b6826d791157c4dda45ec3447ad5f9fcd6046cd75a10e15b59dae77","artifact_state_fingerprint":"25c4e882d6b699d21dddaaae86d619ee58b71b4a44b7917b5fab5a6c2aee5831","bundle_spec_digest":"76ab14c7d5a2f50824491d6859b1ecfd2dd40cecfd0ac951f2d8ed1c23784f2d","cold_start":{"cold_start_ms":"6376.550708","failure_code":null,"fresh_runner":true,"interval_id":"image_e2e_validated_handoff_v1","os_cache_state":"uncontrolled","status":"known"},"collector":{"id":"yolozu_qualifier","source_digest":"e31abff46464eda62d0537e34bcd5cd43983c84a42ee6c8f72284e1cc53b6d67","version":"1"},"completed_at":"2026-09-25T19:05:37Z","conservative_aggregates":{"accelerator_process_tree_peak":{"collector_id":"accelerator_memory","collector_source_digest":"3a764ad6624947aa6cd432f8af5cc6d471213e833729195533f35aa2df27ef42","collector_version":"1","covered_devices":"unknown","covered_processes":"unknown","scope":"unknown","status":"unknown","value_bytes":null},"p50_latency_ms":"5101.565541","p95_latency_ms":"7633.534416","p99_latency_ms":"9520.114875","repeat_throughput_duration_ns":1052487852667,"repeat_throughput_processed_count":200,"repeat_throughput_source_index":2,"runner_tree_peak_rss":{"collector_id":"process_tree_memory","collector_source_digest":"6d1e0727e05848df1f0ef0fe6a955855021ade259c5c389284857b14d93d15f2","collector_version":"1","covered_devices":"not_applicable","covered_processes":"unknown","scope":"unknown","status":"unknown","value_bytes":null}},"environment_fingerprint":"ccd1e394dd5842f725feff67ddd92e3e0abb0dabad836c3df41875f59d97c1ef","execution_mode":"batch","failures":["max_p95_latency_exceeded"],"issuer":{"id":"yolozu_qualification_workflow","source_digest":"dc9a4b8f4fa1293674bd1c1edef00b0cf623d5b73b886aac5d278e7e172f6a7b","version":"1"},"latency_interval":{"handoff_id":"image_result_mask_handoff_v1","handoff_version":1,"included_phases":["decode_pinned_source_bytes","preprocess","predict","postprocess","requested_class_prompt_mapping","strict_result_validation","mask_validation_encoding","result_mask_handoff_completion"],"interval_id":"image_e2e_validated_handoff_v1","publication_boundary":"managed_output_transaction_after_interval"},"lifetime_memory":{"accelerator_process_tree_peak":{"collector_id":"accelerator_memory","collector_source_digest":"3a764ad6624947aa6cd432f8af5cc6d471213e833729195533f35aa2df27ef42","collector_version":"1","covered_devices":"unknown","covered_processes":"unknown","scope":"unknown","status":"unknown","value_bytes":null},"interval_scope":"fresh_runner_creation_through_close","runner_tree_peak_rss":{"collector_id":"process_tree_memory","collector_source_digest":"6d1e0727e05848df1f0ef0fe6a955855021ade259c5c389284857b14d93d15f2","collector_version":"1","covered_devices":"not_applicable","covered_processes":"unknown","scope":"unknown","status":"unknown","value_bytes":null}},"limitations":["Measurements apply only to this immutable bundle, environment, workload, and protocol.","OS filesystem cache state was uncontrolled.","P0 enforces a declared network-free runner but does not claim OS-level network isolation.","Complete runner-tree or accelerator peak memory is unknown unless a full-coverage collector is available.","This report is unactivated and does not establish Stable support or human adoption."],"protocol_fingerprint":"63ac66e2ec9497902150e6b83c07c606d79f2fd46190e12d08a2c029ccef8317","qualification_workload_fingerprint":"2f1daddcec1a2bfdaf61008e14c56ab2eedf9cee826f1afe90b5592f50807529","quality":{"direction":"higher_is_better","evaluation_dataset_id":"local_coco_instances_v1","evaluation_dataset_sha256":"e8c7f7908f1d7278341fae127d0da654f102f11bd7b21d8aeefa635b8c810b6f","evaluation_protocol_sha256":"1c74e4b6b2d93414de420fbe15ea9fd17c9de31619b1856169d803627355ba97","evaluation_vocabulary_id":"torchvision-coco80","measured_value":"0.53920414","metric_id":"simple_bbox_map50_95","predictions_source":"same_qualification_run","status":"known","threshold_context":"0.2"},"repeats":[{"accelerator_process_tree_peak":{"collector_id":"accelerator_memory","collector_source_digest":"3a764ad6624947aa6cd432f8af5cc6d471213e833729195533f35aa2df27ef42","collector_version":"1","covered_devices":"unknown","covered_processes":"unknown","scope":"unknown","status":"unknown","value_bytes":null},"duration_ns":1039472185459,"failure_code":null,"input_coverage_counts":[13,13,13,13,13,13,13,13,12,12,12,12,12,12,12,12],"p50_latency_ms":"5101.565541","p95_latency_ms":"6519.189375","p99_latency_ms":"7410.759833","repeat_index":1,"runner_tree_peak_rss":{"collector_id":"process_tree_memory","collector_source_digest":"6d1e0727e05848df1f0ef0fe6a955855021ade259c5c389284857b14d93d15f2","collector_version":"1","covered_devices":"not_applicable","covered_processes":"unknown","scope":"unknown","status":"unknown","value_bytes":null},"sample_count":200,"status":"completed","throughput_duration_ns":1039472185459,"throughput_processed_count":200},{"accelerator_process_tree_peak":{"collector_id":"accelerator_memory","collector_source_digest":"3a764ad6624947aa6cd432f8af5cc6d471213e833729195533f35aa2df27ef42","collector_version":"1","covered_devices":"unknown","covered_processes":"unknown","scope":"unknown","status":"unknown","value_bytes":null},"duration_ns":1052487852667,"failure_code":null,"input_coverage_counts":[13,13,13,13,13,13,13,13,12,12,12,12,12,12,12,12],"p50_latency_ms":"5089.164709","p95_latency_ms":"7633.534416","p99_latency_ms":"9520.114875","repeat_index":2,"runner_tree_peak_rss":{"collector_id":"process_tree_memory","collector_source_digest":"6d1e0727e05848df1f0ef0fe6a955855021ade259c5c389284857b14d93d15f2","collector_version":"1","covered_devices":"not_applicable","covered_processes":"unknown","scope":"unknown","status":"unknown","value_bytes":null},"sample_count":200,"status":"completed","throughput_duration_ns":1052487852667,"throughput_processed_count":200},{"accelerator_process_tree_peak":{"collector_id":"accelerator_memory","collector_source_digest":"3a764ad6624947aa6cd432f8af5cc6d471213e833729195533f35aa2df27ef42","collector_version":"1","covered_devices":"unknown","covered_processes":"unknown","scope":"unknown","status":"unknown","value_bytes":null},"duration_ns":854058595959,"failure_code":null,"input_coverage_counts":[13,13,13,13,13,13,13,13,12,12,12,12,12,12,12,12],"p50_latency_ms":"4190.847125","p95_latency_ms":"5237.878125","p99_latency_ms":"5323.072125","repeat_index":3,"runner_tree_peak_rss":{"collector_id":"process_tree_memory","collector_source_digest":"6d1e0727e05848df1f0ef0fe6a955855021ade259c5c389284857b14d93d15f2","collector_version":"1","covered_devices":"not_applicable","covered_processes":"unknown","scope":"unknown","status":"unknown","value_bytes":null},"sample_count":200,"status":"completed","throughput_duration_ns":854058595959,"throughput_processed_count":200}],"report_digest":"ba3850695b760b059b4d61d6cc39e66c0c2f3cbff1326568a34208a579862b12","report_id":"qualification-20260925T190537Z-76ab14c7d5a2","resolved_pipeline":{"decoder":{"id":"pillow_rgb_v1","source_digest":"5c9e8680b40e1467c3534b7577b7f4d96808fa65ccaacab01a56eeaf12a04ebd","version":"1"},"model_input":{"id":"bundle_model_input_shapes","source_digest":"b1e6a98c3a6d61e2cc83d26ec8f68be8c8fd51db733a1d484db6ea21b59643b7","version":"1"},"postprocess":{"id":"torchvision_coco_xyxy_v1","source_digest":"24063d2eb3841954463b84ec1730728e935caf043ff18648f838e0e8124f08d2","version":"1"},"preprocess":{"id":"torchvision_maskrcnn_embedded_v1","source_digest":"aae3debe28fcd5ae2bf33c739a189c375d40e567d0da392277bd45db735fe440","version":"1"}},"schema_version":1,"source_runtime_provenance":{"model_revision":"f9718a5b9fa717457cfe15507ca6e48ecdd3858e","model_source_id":"https://github.com/pytorch/vision","provider_id":"cpu","provider_version":"1","runtime_id":"torch","runtime_version":"2.12.0.dev20260330"},"started_at":"2026-09-25T18:13:25Z","status":"hold","sustained_section":{"reason":"batch_profile","status":"not_required"},"task":"object_detection","valid_until":"2026-12-24T19:05:37Z","warmup":{"failure_code":null,"iteration_count":20,"status":"completed"}}